{
  "$schema": "http://json-schema.org/draft-06/schema",
  "type": "object",
  "properties": {
    "version": {
      "type": "number"
    },
    "success": {
      "type": "boolean"
    },
    "reason": {},
    "content": {
      "type": "object",
      "properties": {
        "issue_url": {
          "type": "string"
        },
        "issue_url_internal": {
          "type": "string"
        },
        "issue_key": {
          "type": "string"
        },
        "issue": {
          "type": "object",
          "properties": {
            "expand": {
              "type": "string"
            },
            "id": {
              "type": "string"
            },
            "self": {
              "type": "string"
            },
            "key": {
              "type": "string"
            },
            "fields": {
              "type": "object",
              "properties": {
                "statuscategorychangedate": {
                  "type": "string"
                },
                "issuetype": {
                  "type": "object",
                  "properties": {
                    "self": {
                      "type": "string"
                    },
                    "id": {
                      "type": "string"
                    },
                    "description": {
                      "type": "string"
                    },
                    "iconUrl": {
                      "type": "string"
                    },
                    "name": {
                      "type": "string"
                    },
                    "subtask": {
                      "type": "boolean"
                    },
                    "avatarId": {
                      "type": "integer"
                    },
                    "entityId": {
                      "type": "string"
                    },
                    "hierarchyLevel": {
                      "type": "integer"
                    }
                  }
                },
                "timespent": {},
                "customfield_10030": {},
                "project": {
                  "type": "object",
                  "properties": {
                    "self": {
                      "type": "string"
                    },
                    "id": {
                      "type": "string"
                    },
                    "key": {
                      "type": "string"
                    },
                    "name": {
                      "type": "string"
                    },
                    "projectTypeKey": {
                      "type": "string"
                    },
                    "simplified": {
                      "type": "boolean"
                    },
                    "avatarUrls": {
                      "type": "object",
                      "properties": {
                        "48x48": {
                          "type": "string"
                        },
                        "24x24": {
                          "type": "string"
                        },
                        "16x16": {
                          "type": "string"
                        },
                        "32x32": {
                          "type": "string"
                        }
                      }
                    }
                  }
                },
                "customfield_10031": {},
                "fixVersions": {
                  "type": "array"
                },
                "aggregatetimespent": {},
                "resolution": {},
                "customfield_10035": {},
                "customfield_10027": {},
                "customfield_10028": {},
                "customfield_10029": {},
                "resolutiondate": {},
                "workratio": {
                  "type": "integer"
                },
                "issuerestriction": {
                  "type": "object",
                  "properties": {
                    "issuerestrictions": {
                      "type": "object"
                    },
                    "shouldDisplay": {
                      "type": "boolean"
                    }
                  }
                },
                "watches": {
                  "type": "object",
                  "properties": {
                    "self": {
                      "type": "string"
                    },
                    "watchCount": {
                      "type": "integer"
                    },
                    "isWatching": {
                      "type": "boolean"
                    }
                  }
                },
                "lastViewed": {},
                "created": {
                  "type": "string"
                },
                "customfield_10020": {},
                "customfield_10021": {},
                "customfield_10022": {},
                "customfield_10023": {},
                "priority": {
                  "type": "object",
                  "properties": {
                    "self": {
                      "type": "string"
                    },
                    "iconUrl": {
                      "type": "string"
                    },
                    "name": {
                      "type": "string"
                    },
                    "id": {
                      "type": "string"
                    }
                  }
                },
                "customfield_10024": {},
                "customfield_10025": {},
                "labels": {
                  "type": "array"
                },
                "customfield_10026": {},
                "customfield_10016": {},
                "customfield_10017": {},
                "customfield_10018": {
                  "type": "object",
                  "properties": {
                    "hasEpicLinkFieldDependency": {
                      "type": "boolean"
                    },
                    "showField": {
                      "type": "boolean"
                    },
                    "nonEditableReason": {
                      "type": "object",
                      "properties": {
                        "reason": {
                          "type": "string"
                        },
                        "message": {
                          "type": "string"
                        }
                      }
                    }
                  }
                },
                "customfield_10019": {
                  "type": "string"
                },
                "timeestimate": {},
                "aggregatetimeoriginalestimate": {},
                "versions": {
                  "type": "array"
                },
                "issuelinks": {
                  "type": "array"
                },
                "assignee": {
                  "type": "object",
                  "properties": {
                    "self": {
                      "type": "string"
                    },
                    "accountId": {
                      "type": "string"
                    },
                    "emailAddress": {
                      "type": "string"
                    },
                    "avatarUrls": {
                      "type": "object",
                      "properties": {
                        "48x48": {
                          "type": "string"
                        },
                        "24x24": {
                          "type": "string"
                        },
                        "16x16": {
                          "type": "string"
                        },
                        "32x32": {
                          "type": "string"
                        }
                      }
                    },
                    "displayName": {
                      "type": "string"
                    },
                    "active": {
                      "type": "boolean"
                    },
                    "timeZone": {
                      "type": "string"
                    },
                    "accountType": {
                      "type": "string"
                    }
                  }
                },
                "updated": {
                  "type": "string"
                },
                "status": {
                  "type": "object",
                  "properties": {
                    "self": {
                      "type": "string"
                    },
                    "description": {
                      "type": "string"
                    },
                    "iconUrl": {
                      "type": "string"
                    },
                    "name": {
                      "type": "string"
                    },
                    "id": {
                      "type": "string"
                    },
                    "statusCategory": {
                      "type": "object",
                      "properties": {
                        "self": {
                          "type": "string"
                        },
                        "id": {
                          "type": "integer"
                        },
                        "key": {
                          "type": "string"
                        },
                        "colorName": {
                          "type": "string"
                        },
                        "name": {
                          "type": "string"
                        }
                      }
                    }
                  }
                },
                "components": {
                  "type": "array"
                },
                "timeoriginalestimate": {},
                "description": {
                  "type": "string"
                },
                "customfield_10010": {},
                "customfield_10014": {},
                "timetracking": {
                  "type": "object"
                },
                "customfield_10015": {},
                "customfield_10005": {},
                "customfield_10006": {},
                "customfield_10007": {},
                "security": {},
                "customfield_10008": {},
                "customfield_10009": {},
                "aggregatetimeestimate": {},
                "attachment": {
                  "type": "array"
                },
                "summary": {
                  "type": "string"
                },
                "creator": {
                  "type": "object",
                  "properties": {
                    "self": {
                      "type": "string"
                    },
                    "accountId": {
                      "type": "string"
                    },
                    "emailAddress": {
                      "type": "string"
                    },
                    "avatarUrls": {
                      "type": "object",
                      "properties": {
                        "48x48": {
                          "type": "string"
                        },
                        "24x24": {
                          "type": "string"
                        },
                        "16x16": {
                          "type": "string"
                        },
                        "32x32": {
                          "type": "string"
                        }
                      }
                    },
                    "displayName": {
                      "type": "string"
                    },
                    "active": {
                      "type": "boolean"
                    },
                    "timeZone": {
                      "type": "string"
                    },
                    "accountType": {
                      "type": "string"
                    }
                  }
                },
                "subtasks": {
                  "type": "array"
                },
                "reporter": {
                  "type": "object",
                  "properties": {
                    "self": {
                      "type": "string"
                    },
                    "accountId": {
                      "type": "string"
                    },
                    "emailAddress": {
                      "type": "string"
                    },
                    "avatarUrls": {
                      "type": "object",
                      "properties": {
                        "48x48": {
                          "type": "string"
                        },
                        "24x24": {
                          "type": "string"
                        },
                        "16x16": {
                          "type": "string"
                        },
                        "32x32": {
                          "type": "string"
                        }
                      }
                    },
                    "displayName": {
                      "type": "string"
                    },
                    "active": {
                      "type": "boolean"
                    },
                    "timeZone": {
                      "type": "string"
                    },
                    "accountType": {
                      "type": "string"
                    }
                  }
                },
                "aggregateprogress": {
                  "type": "object",
                  "properties": {
                    "progress": {
                      "type": "integer"
                    },
                    "total": {
                      "type": "integer"
                    }
                  }
                },
                "customfield_10001": {},
                "customfield_10002": {},
                "customfield_10003": {},
                "customfield_10004": {},
                "environment": {},
                "duedate": {},
                "progress": {
                  "type": "object",
                  "properties": {
                    "progress": {
                      "type": "integer"
                    },
                    "total": {
                      "type": "integer"
                    }
                  }
                },
                "comment": {
                  "type": "object",
                  "properties": {
                    "comments": {
                      "type": "array"
                    },
                    "self": {
                      "type": "string"
                    },
                    "maxResults": {
                      "type": "integer"
                    },
                    "total": {
                      "type": "integer"
                    },
                    "startAt": {
                      "type": "integer"
                    }
                  }
                },
                "votes": {
                  "type": "object",
                  "properties": {
                    "self": {
                      "type": "string"
                    },
                    "votes": {
                      "type": "integer"
                    },
                    "hasVoted": {
                      "type": "boolean"
                    }
                  }
                },
                "worklog": {
                  "type": "object",
                  "properties": {
                    "startAt": {
                      "type": "integer"
                    },
                    "maxResults": {
                      "type": "integer"
                    },
                    "total": {
                      "type": "integer"
                    },
                    "worklogs": {
                      "type": "array"
                    }
                  }
                }
              }
            }
          }
        },
        "jira_dt_name": {
          "type": "string"
        }
      }
    },
    "raw": {},
    "inputs": {
      "type": "object",
      "properties": {
        "incident_id": {
          "type": "integer"
        },
        "jira_fields": {
          "type": "string"
        },
        "jira_label": {
          "type": "string"
        }
      }
    },
    "metrics": {
      "type": "object",
      "properties": {
        "version": {
          "type": "string"
        },
        "package": {
          "type": "string"
        },
        "package_version": {
          "type": "string"
        },
        "host": {
          "type": "string"
        },
        "execution_time_ms": {
          "type": "integer"
        },
        "timestamp": {
          "type": "string"
        }
      }
    }
  }
}